ship_name,name,operator_name,currency,overview,start_date,end_date,embark_port,disembark_port,overview_tile,passenger_capacity,physical_rating,includes_flight,destination_name,region_names,gst
Akademic Vavilov,Ultimate Antarctica; Peninsula and Weddell Sea (reverse),One Ocean Expeditions ,USD,"This exciting expedition provides great diversity and will appeal to those seeking a truly comprehensive Antarctic experience. It includes visits to the South Shetland Islands, the western and northern sections of the Antarctic Peninsula, the stunning Weddell Sea region, and the historic location of Elephant Island – a place forever connected to the epic story of Sir Ernest Shackleton. Adding to the experience will be a visit to several locations in the Falkland Islands, including the homes of nesting albatross and the colorful King penguin. Throughout the voyage, our expedition ship acts as a floating wilderness lodge, which we reposition every day to yet another exciting location. You will be spoiled for choice by all of the activities we have planned.",30-Jan-18,10-Feb-18,Punta Arenas,Punta Arenas ,"Exploring both coastlines of the Antarctic Peninsula, this voyages delivers a diverse program, which 
incorporates the South Shetland Is, the Weddell Sea, Elephant Is and of couse the Antarctic Peninsula",96,Soft Adventure,TRUE,Antarctica,"Antarctic Peninsula, South Shetland Islands, Weddell Sea",0
Akademic Vavilov,Antarctica - Deep South (extended Circle voyge),One Ocean Expeditions ,USD,"This special journey takes you further south than at any other time in the season.

By flying to King George Island in Antarctica at the start of the voyage, we save two days on the ocean crossing. The time we save by flying south, allows for a more substantial exploration below the Antarctic Circle. Here we witness stunning landscapes, sizable Adelie penguin rookeries and large flat-topped tabular icebergs that drift north from the Bellingshausen Sea. We always anticipate exciting ice navigation when we push this far south.",20-Feb-18,3-Mar-18,Punta Arenas,Punta Arenas ,A voyage to take you below the Antarctic Circle and further south than any other,96,Soft Adventure,TRUE,Antarctica,"Antarctic Peninsula, South Shetland Islands, Antarctic Circle",0
Akademic Vavilov,Antarctic Peninsula Adventure,One Ocean Expeditions ,USD,"This Antarctic cruise explores the Antarctic Peninsula over a period of 10 nights/11 days. A classic itinerary for whale watching, seabird viewing, visiting penguin colonies and experiencing zodiac excursions in Antarctica. Camping in Antarctica is included.

This voyage visits many of the classic landing locations along the Antarctica Peninsula such as Paradise Harbour, Neko Harbour and the Errera Channel. Vice conditions permitting, we always attempt a transit of the Lemaire Channel, the gateway to the southern jewels of Petermann Island and Pleneau Island. In the company of our expert guides, we spend our days exploring in small groups, by zodiac boat and on shore, enjoying walks and hikes to scenic locations and visiting busy wildlife colonies. Sea kayaking and overnight camping are also popular activities on this itinerary.",3-Mar-18,13-Mar-18,Ushuaia,Ushuaia,"A classic itinerary for whale watching, seabird viewing, visiting penguin colonies and experiencing zodiac excursions in Antarctica.",96,Soft Adventure,FALSE,Antarctica,"Antarctic Peninsula, South Shetland Islands",0
Akademic Vavilov,Antarctic Peninsula - Marine Mammals,One Ocean Expeditions ,USD,"By March, the short Antarctic summer is drawing to a close. Penguin chicks are almost fully-grown and quickly shedding their downy coats in preparation to take to the sea before the long winter. March is a time of great activity in and under the water where we have historically encountered a high concentration of whales, in particular Humpback and Minke. Crabeater, Weddell and Leopard seals also often grace us with their presence, as they rest and store energy that will sustain them over the cold months ahead.",23-Mar-18,2-Apr-18,Ushuaia,Ushuaia,"A perfect voyage for those interested in the mammals of Antarctica, wonderful whale displays
are common over this time and with shorter days the twilight hues are ideal for photographers",96,Soft Adventure,FALSE,Antarctica,"Antarctic Peninsula, South Shetland Islands",0
Akademic Vavilov,Epic Antarctica 1: ,One Ocean Expeditions ,USD,"This exciting new expedition has been many years in the making. It is undoubtedly the most comprehensive journey to Antarctica ever offered.

This unique experience links two existing voyages to create one ‘super adventure’. Over the course of three weeks, we spend an unprecedented 16 days exploring the Antarctic Peninsula, South Shetland Islands, the spectacular, icy Weddell Sea region and the wildlife-rich Falkland Islands.",30-Dec-17,20-Jan-18,Punta Arenas,Punta Arenas ,"A voyage of unprecedented experiences, with 16 days explore the Antarctic Peninsula, 
South Shetland Is, Weddell Sea and the Falkland Is",96,Soft Adventure,TRUE,Antarctica,"Antarctic Peninsula, South Shetland Islands, Antarctic Circle, Weddell Sea, Falkland Islands",0
Akademic Vavilov,Epic Antarctica 2:,One Ocean Expeditions ,USD,"This exciting new expedition has been many years in the making. It is undoubtedly the most comprehensive journey to Antarctica ever offered.

This unique experience links two existing voyages to create one ‘super adventure’. Over the course of three weeks, we spend an unprecedented 16 days exploring the Antarctic Peninsula, South Shetland Islands, the spectacular, icy Weddell Sea region and the wildlife-rich Falkland Islands.",20-Jan-18,10-Feb-18,Punta Arenas,Punta Arenas ,"A voyage of unprecedented experiences, with 16 days explore the Antarctic Peninsula, 
South Shetland Is, Weddell Sea and the Falkland Is",96,Soft Adventure,TRUE,Antarctica,"Antarctic Peninsula, South Shetland Islands, Antarctic Circle, Weddell Sea, Falkland Islands",0
Alk,"Submersible Pilot Programme-
Introduction Pilot Course",Waterproof Expeditions,USD,"The courses are held in Malta, the most historical island of the Mediterranean sea, known for its many deep wrecks.

During the Pilot training course your days are spent on board the explorer yacht ‘Alk’, the support vessel that carries the sub.  The yacht is comfortable and you can use a day cabin with private facilities, for relaxing and storage of your daily luggage.  Lunch, snacks  and (non-alcoholic) drinks are included.

In the morning we pick you up, and in the evening we bring you back to your hotel.  At least one night will be spent on board, when the dive sites explored are too far away to return back to the hotel. 

Depending on the Pilot course you are required to do a pre-theory study at home prior to the course. The course manual and instructions for your theory home study will be mailed to your address after confirmation of the reservation.

Each day of diving will end by an extensive post-dive check to make sure the Submersible is stored in an appropriate way.
Wind and swells will predict the day by day schedule so a measure of flexibility is something all of us must bring along on this exciting programme.",01 Jun 18,30 Aug 2018,Malta,Malta,For anyone fascinated by the deep Ocean and dreaming of a deep sea experience.  No pre-study. Hands-on. Focused on diving.,,Expedition,FALSE,The Arctic,,
Bark Europa,Ocean Sailing,Bark Europa,USD,"This excellent open ocean sailing program sails from the Bay of Montevideo, Uruguay to the Falkland Islands. 

It is a great introductory voyage to sailing in a tall ship and combines perfectly with the subsequent voyage to Antarctica on board the Bark Europa.",01-Nov-17,15-Nov-17,Montevideo,Falkland Islands,An excellent ocean sailing program exploring the Falkland Islands,48,Expedition,FALSE,Antarctica,Falkland Islands,0
Bark Europa,True Southern Ocean Sailing,Bark Europa,USD,"EUROPA sails from Stanley on the Falkland Islands towards South Georgia. During this leg EUROPA can usually take advantage of the prevailing strong (and sometimes stormy) westerly winds making for a good crossing to South Georgia You will be able to experience all the aspects of seaman’s life, including watch keeping, climbing the masts and classic navigation. In sailing the EUROPA, teamwork is the keyword. On board you learn the names of the hundreds of different lines and 30 sails. Everybody will experience the voyage differently; The horizon will sail with the ship day after day, Wandering Albatrosses, dolphins who play in the bow wave, a waxing and waning moon, etcetera.

If you have a bit more time at hand, combine this trip with some extra sailing days and join the ship in Montevideo. As you will not need a flight ticket to the Falklands that is budget proof solution for 18 extra days of sailing and exploring. Three night bed & breakfast on board when in Port Stanley is included in the special combination fare",18-Nov-17,21-Dec-17,Falkland Islands,Ushuaia,The Bark Europa's only South Georgia and Antarctica departure! ,48,Expedition,FALSE,Antarctica,"Antarctic Peninsula, South Shetland Islands, Falkland Islands, South Georgia ",0
Bark Europa,Antarctic Peninsula,Bark Europa,USD,"The expeditions start in Argentina in Ushuaia, the southernmost city in South America, located alongside the Beagle Channel. From here, the ship must cross ‘the Drake Passage’, renowned by sailors the world over. Albatrosses and petrels will accompany the EUROPA on her way to the Antarctic paradise. After passing the Antarctic Convergence Zone, the ship sails between the icebergs to the South Shetland Islands. The wildlife is overwhelming: seals, sea-gulls, cormorants and petrels use the Antarctic summer to raise their young. In the Antarctic waters, the EUROPA will anchor in sheltered bays practically every day. The crew will take groups ashore in the dinghies to see glaciers, mosses and lichens, seals, birds and penguin rookeries. Ashore, visitors will often be welcomed by different kinds of penguins, such as the Gentoo, Chinstrap and Adelie penguins. Our experienced guide will give you information about the flora and fauna and will also tell you where to find bird and sea elephant colonies. The ship will sail further south. We expect the most loyal visitors of the Southern Ocean: enormous Humpback whales; Minke whales and even Orcas or Killer whales may well come close to us, curious to see who ventures into their waters. Ice masses will get bigger closer to the mainland. Steep glaciers, walls of ice with magical shapes and surreal colours will surround the EUROPA.",23-Dec-17,13-Jan-18,Ushuaia,Ushuaia,A unique experience on board the only tall ship undertaking expeditions to Antarctica,48,Expedition,FALSE,Antarctica,"Antarctic Peninsula, South Shetland Islands",0
Bark Europa,Antarctic Peninsula,Bark Europa,USD,"The expeditions start in Argentina in Ushuaia, the southernmost city in South America, located alongside the Beagle Channel. From here, the ship must cross ‘the Drake Passage’, renowned by sailors the world over. Albatrosses and petrels will accompany the EUROPA on her way to the Antarctic paradise. After passing the Antarctic Convergence Zone, the ship sails between the icebergs to the South Shetland Islands. The wildlife is overwhelming: seals, sea-gulls, cormorants and petrels use the Antarctic summer to raise their young. In the Antarctic waters, the EUROPA will anchor in sheltered bays practically every day. The crew will take groups ashore in the dinghies to see glaciers, mosses and lichens, seals, birds and penguin rookeries. Ashore, visitors will often be welcomed by different kinds of penguins, such as the Gentoo, Chinstrap and Adelie penguins. Our experienced guide will give you information about the flora and fauna and will also tell you where to find bird and sea elephant colonies. The ship will sail further south. We expect the most loyal visitors of the Southern Ocean: enormous Humpback whales; Minke whales and even Orcas or Killer whales may well come close to us, curious to see who ventures into their waters. Ice masses will get bigger closer to the mainland. Steep glaciers, walls of ice with magical shapes and surreal colours will surround the EUROPA.",15-Jan-18,05-Feb-18,Ushuaia,Ushuaia,A unique experience on board the only tall ship undertaking expeditions to Antarctica,48,Expedition,FALSE,Antarctica,"Antarctic Peninsula, South Shetland Islands",0
Bark Europa,Antarctica Photography Expedition,Bark Europa ,USD,"All the basics of an expedition with the bark EUROPA is participating in helping to sail the ship however during this voyage there will be more additional focus on (wildlife)photography and on how to get the best picture under certain circumstances. There will be lectures about the places we visit and the animals you may encounter, but our team of natureguides will be completed with 2 professional photographers. Together they will guide you during your expedition through the white continent and with your own camera gear you will shoot the best pictures! The itinerary and timing will be planned the most suitable way for photographers. We will chase the best light, catch opportunities to observe wildlife and of course, use our beautiful Bark Europa as a perfect model among the beauty of Antarctica!",07-Feb-18,28-Feb-18,Ushuaia ,Ushuaia,Sail aboard the Bark Europa on this photographic specific voyage and capture her majesty in the pristine Antarctic landscape,48,Expedition,FALSE,Antarctica,"Antarctic Peninsula, South Shetland Islands",0
Bark Europa,"Antarctica, South Georgia to Cape Town",Bark Europa,USD,"After leaving the Beagle Channel it is time to cross the Drake, visit the Antarctic Peninsula and depending on ice- and weather conditions the Weddellsea. The sails are hoisted for a serious sail to the beautiful island of South Georgia. We will spend about a week here and have a daily routine of moving the ship from one fjord to the other and make landings, enjoying the wildlife and hikes. We’ll find the remains of a former whaling station at Grytviken and see the grave of Shackleton, one of the most heroic pole travellers. It is an old tradition to drink a glass of whisky near his grave.

Heading back to sea course is set for Tristan da Cunha: the most remote island of the world. Here, in the middle of the Atlantic Ocean, a small community lives on top of an active volcano. Let’s hope that the swell isn’t big enough to prevent a safe landing. On Tristan you can play golf on the most remote course of the planet or go fishing for lobster with the local fisherman. The final leg of this long voyage is a beautiful sail of about 10 days to Cape Town. Mid April the Table Mountain will appear on the horizon and the ship will be berthed along the quay in the V&A Waterfront. ",03-Mar-18,23-Apr-18,Ushuaia,Cape Town,The ultimate Cape to Cape expedition voyage under sail! ,48,Expedition,FALSE,Antarctica,"Antarctic Peninsula, South Shetland Islands, South Georgia",0